14:01:14.244013 08:00:27:a3:d0:17 > 52:54:00:12:35:02, ethertype IPv4 (0x0800), length 100: 10.0.2.15.34301 > 172.31.1.130.53: 50863+ [1au] A? connectivity-check.ubuntu.com. (58)
14:01:14.250332 52:54:00:12:35:02 > 08:00:27:a3:d0:17, ethertype IPv4 (0x0800), length 428: 172.31.1.130.53 > 10.0.2.15.34301: 50863 9/3/7 A 185.125.190.18, A 35.232.111.17, A 91.189.91.48, A 91.189.91.49, A 35.224.170.84, A 185.125.190.48, A 185.125.190.49, A 185.125.190.17, A 34.122.121.32 (386)
14:01:14.252505 08:00:27:a3:d0:17 > 52:54:00:12:35:02, ethertype IPv4 (0x0800), length 74: 10.0.2.15.43266 > 185.125.190.18.80: Flags [S], seq 729176362, win 64240, options [mss 1460,sackOK,TS val 3827990757 ecr 0,nop,wscale 7], length 0
14:01:14.433834 52:54:00:12:35:02 > 08:00:27:a3:d0:17, ethertype IPv4 (0x0800), length 60: 185.125.190.18.80 > 10.0.2.15.43266: Flags [S.], seq 35584001, ack 729176363, win 65535, options [mss 1460], length 0
14:01:14.434147 08:00:27:a3:d0:17 > 52:54:00:12:35:02, ethertype IPv4 (0x0800), length 54: 10.0.2.15.43266 > 185.125.190.18.80: Flags [.], ack 1, win 64240, length 0
14:01:14.435396 08:00:27:a3:d0:17 > 52:54:00:12:35:02, ethertype IPv4 (0x0800), length 141: 10.0.2.15.43266 > 185.125.190.18.80: Flags [P.], seq 1:88, ack 1, win 64240, length 87: HTTP: GET / HTTP/1.1
14:01:14.436024 52:54:00:12:35:02 > 08:00:27:a3:d0:17, ethertype IPv4 (0x0800), length 60: 185.125.190.18.80 > 10.0.2.15.43266: Flags [.], ack 88, win 65535, length 0
14:01:14.615970 52:54:00:12:35:02 > 08:00:27:a3:d0:17, ethertype IPv4 (0x0800), length 243: 185.125.190.18.80 > 10.0.2.15.43266: Flags [P.], seq 1:190, ack 88, win 65535, length 189: HTTP: HTTP/1.1 204 No Content
14:01:14.615993 08:00:27:a3:d0:17 > 52:54:00:12:35:02, ethertype IPv4 (0x0800), length 54: 10.0.2.15.43266 > 185.125.190.18.80: Flags [.], ack 190, win 64051, length 0
14:01:14.617739 52:54:00:12:35:02 > 08:00:27:a3:d0:17, ethertype IPv4 (0x0800), length 60: 185.125.190.18.80 > 10.0.2.15.43266: Flags [F.], seq 190, ack 88, win 65535, length 0
14:01:14.619348 08:00:27:a3:d0:17 > 52:54:00:12:35:02, ethertype IPv4 (0x0800), length 54: 10.0.2.15.43266 > 185.125.190.18.80: Flags [F.], seq 88, ack 191, win 64051, length 0
14:01:14.619954 52:54:00:12:35:02 > 08:00:27:a3:d0:17, ethertype IPv4 (0x0800), length 60: 185.125.190.18.80 > 10.0.2.15.43266: Flags [.], ack 89, win 65535, length 0
14:04:41.996205 08:00:27:a3:d0:17 > 33:33:00:00:00:02, ethertype IPv6 (0x86dd), length 62: fe80::b1a5:303c:d7b8:5b3f > ff02::2: ICMP6, router solicitation, length 8
14:04:44.244773 08:00:27:a3:d0:17 > 52:54:00:12:35:02, ethertype IPv4 (0x0800), length 100: 10.0.2.15.54445 > 172.31.1.130.53: 48390+ [1au] AAAA? connectivity-check.ubuntu.com. (58)
14:04:44.247872 52:54:00:12:35:02 > 08:00:27:a3:d0:17, ethertype IPv4 (0x0800), length 452: 172.31.1.130.53 > 10.0.2.15.54445: 48390 6/3/7 AAAA 2620:2d:4000:1::22, AAAA 2620:2d:4000:1::2b, AAAA 2001:67c:1562::23, AAAA 2001:67c:1562::24, AAAA 2620:2d:4000:1::2a, AAAA 2620:2d:4000:1::23 (410)
14:04:49.644023 08:00:27:a3:d0:17 > 52:54:00:12:35:02, ethertype ARP (0x0806), length 42: Request who-has 10.0.2.2 tell 10.0.2.15, length 28
14:04:49.645278 52:54:00:12:35:02 > 08:00:27:a3:d0:17, ethertype ARP (0x0806), length 60: Reply 10.0.2.2 is-at 52:54:00:12:35:02, length 46
14:05:21.434887 08:00:27:a3:d0:17 > 33:33:00:00:00:fb, ethertype IPv6 (0x86dd), length 107: fe80::b1a5:303c:d7b8:5b3f.5353 > ff02::fb.5353: 0 [2q] PTR (QM)? _ipp._tcp.local. PTR (QM)? _ipps._tcp.local. (45)
14:05:21.435924 08:00:27:a3:d0:17 > 01:00:5e:00:00:fb, ethertype IPv4 (0x0800), length 87: 10.0.2.15.5353 > 224.0.0.251.5353: 0 [2q] PTR (QM)? _ipp._tcp.local. PTR (QM)? _ipps._tcp.local. (45)
14:06:02.636927 08:00:27:a3:d0:17 > 33:33:00:00:00:fb, ethertype IPv6 (0x86dd), length 180: fe80::b1a5:303c:d7b8:5b3f.5353 > ff02::fb.5353: 0 [7q] PTR (QM)? _ftp._tcp.local. PTR (QM)? _nfs._tcp.local. PTR (QM)? _afpovertcp._tcp.local. PTR (QM)? _smb._tcp.local. PTR (QM)? _sftp-ssh._tcp.local. PTR (QM)? _webdavs._tcp.local. PTR (QM)? _webdav._tcp.local. (118)
14:06:02.638862 08:00:27:a3:d0:17 > 01:00:5e:00:00:fb, ethertype IPv4 (0x0800), length 160: 10.0.2.15.5353 > 224.0.0.251.5353: 0 [7q] PTR (QM)? _ftp._tcp.local. PTR (QM)? _nfs._tcp.local. PTR (QM)? _afpovertcp._tcp.local. PTR (QM)? _smb._tcp.local. PTR (QM)? _sftp-ssh._tcp.local. PTR (QM)? _webdavs._tcp.local. PTR (QM)? _webdav._tcp.local. (118)
14:06:14.331822 08:00:27:a3:d0:17 > 52:54:00:12:35:02, ethertype IPv4 (0x0800), length 100: 10.0.2.15.58230 > 172.31.1.130.53: 27867+ [1au] A? connectivity-check.ubuntu.com. (58)
14:06:14.526355 52:54:00:12:35:02 > 08:00:27:a3:d0:17, ethertype IPv4 (0x0800), length 428: 172.31.1.130.53 > 10.0.2.15.58230: 27867 9/3/7 A 35.224.170.84, A 35.232.111.17, A 91.189.91.48, A 34.122.121.32, A 185.125.190.49, A 91.189.91.49, A 185.125.190.48, A 185.125.190.18, A 185.125.190.17 (386)
14:06:14.535431 08:00:27:a3:d0:17 > 52:54:00:12:35:02, ethertype IPv4 (0x0800), length 74: 10.0.2.15.59120 > 35.224.170.84.80: Flags [S], seq 3485781648, win 64240, options [mss 1460,sackOK,TS val 2754789003 ecr 0,nop,wscale 7], length 0
14:06:14.898445 52:54:00:12:35:02 > 08:00:27:a3:d0:17, ethertype IPv4 (0x0800), length 60: 35.224.170.84.80 > 10.0.2.15.59120: Flags [S.], seq 36992001, ack 3485781649, win 65535, options [mss 1460], length 0
14:06:14.898827 08:00:27:a3:d0:17 > 52:54:00:12:35:02, ethertype IPv4 (0x0800), length 54: 10.0.2.15.59120 > 35.224.170.84.80: Flags [.], ack 1, win 64240, length 0
14:06:14.900806 08:00:27:a3:d0:17 > 52:54:00:12:35:02, ethertype IPv4 (0x0800), length 141: 10.0.2.15.59120 > 35.224.170.84.80: Flags [P.], seq 1:88, ack 1, win 64240, length 87: HTTP: GET / HTTP/1.1
14:06:14.901400 52:54:00:12:35:02 > 08:00:27:a3:d0:17, ethertype IPv4 (0x0800), length 60: 35.224.170.84.80 > 10.0.2.15.59120: Flags [.], ack 88, win 65535, length 0
14:06:15.209472 52:54:00:12:35:02 > 08:00:27:a3:d0:17, ethertype IPv4 (0x0800), length 202: 35.224.170.84.80 > 10.0.2.15.59120: Flags [P.], seq 1:149, ack 88, win 65535, length 148: HTTP: HTTP/1.1 204 No Content
14:06:15.209499 08:00:27:a3:d0:17 > 52:54:00:12:35:02, ethertype IPv4 (0x0800), length 54: 10.0.2.15.59120 > 35.224.170.84.80: Flags [.], ack 149, win 64092, length 0
14:06:15.209842 52:54:00:12:35:02 > 08:00:27:a3:d0:17, ethertype IPv4 (0x0800), length 60: 35.224.170.84.80 > 10.0.2.15.59120: Flags [F.], seq 149, ack 88, win 65535, length 0
14:06:15.212093 08:00:27:a3:d0:17 > 52:54:00:12:35:02, ethertype IPv4 (0x0800), length 54: 10.0.2.15.59120 > 35.224.170.84.80: Flags [F.], seq 88, ack 150, win 64091, length 0
14:06:15.214875 52:54:00:12:35:02 > 08:00:27:a3:d0:17, ethertype IPv4 (0x0800), length 60: 35.224.170.84.80 > 10.0.2.15.59120: Flags [.], ack 89, win 65535, length 0
14:09:38.222247 08:00:27:a3:d0:17 > 52:54:00:12:35:02, ethertype IPv4 (0x0800), length 90: 10.0.2.15.50430 > 185.125.190.57.123: NTPv4, Client, length 48
14:09:38.402663 52:54:00:12:35:02 > 08:00:27:a3:d0:17, ethertype IPv4 (0x0800), length 90: 185.125.190.57.123 > 10.0.2.15.50430: NTPv4, Server, length 48
14:09:43.396865 08:00:27:a3:d0:17 > 52:54:00:12:35:02, ethertype ARP (0x0806), length 42: Request who-has 10.0.2.2 tell 10.0.2.15, length 28
14:09:43.399955 52:54:00:12:35:02 > 08:00:27:a3:d0:17, ethertype ARP (0x0806), length 60: Reply 10.0.2.2 is-at 52:54:00:12:35:02, length 46
14:09:44.288674 08:00:27:a3:d0:17 > 52:54:00:12:35:02, ethertype IPv4 (0x0800), length 100: 10.0.2.15.49439 > 172.31.1.130.53: 37483+ [1au] AAAA? connectivity-check.ubuntu.com. (58)
14:09:44.291514 52:54:00:12:35:02 > 08:00:27:a3:d0:17, ethertype IPv4 (0x0800), length 452: 172.31.1.130.53 > 10.0.2.15.49439: 37483 6/3/7 AAAA 2620:2d:4000:1::22, AAAA 2001:67c:1562::24, AAAA 2620:2d:4000:1::2b, AAAA 2620:2d:4000:1::2a, AAAA 2001:67c:1562::23, AAAA 2620:2d:4000:1::23 (410)
14:11:14.356614 08:00:27:a3:d0:17 > 52:54:00:12:35:02, ethertype IPv4 (0x0800), length 100: 10.0.2.15.44589 > 172.31.1.130.53: 11633+ [1au] A? connectivity-check.ubuntu.com. (58)
14:11:14.360134 52:54:00:12:35:02 > 08:00:27:a3:d0:17, ethertype IPv4 (0x0800), length 428: 172.31.1.130.53 > 10.0.2.15.44589: 11633 9/3/7 A 35.232.111.17, A 185.125.190.49, A 185.125.190.18, A 35.224.170.84, A 34.122.121.32, A 185.125.190.17, A 185.125.190.48, A 91.189.91.48, A 91.189.91.49 (386)
14:11:14.378180 08:00:27:a3:d0:17 > 52:54:00:12:35:02, ethertype IPv4 (0x0800), length 74: 10.0.2.15.39578 > 35.232.111.17.80: Flags [S], seq 37747293, win 64240, options [mss 1460,sackOK,TS val 3247114322 ecr 0,nop,wscale 7], length 0
14:11:14.663938 52:54:00:12:35:02 > 08:00:27:a3:d0:17, ethertype IPv4 (0x0800), length 60: 35.232.111.17.80 > 10.0.2.15.39578: Flags [S.], seq 38400001, ack 37747294, win 65535, options [mss 1460], length 0
14:11:14.664129 08:00:27:a3:d0:17 > 52:54:00:12:35:02, ethertype IPv4 (0x0800), length 54: 10.0.2.15.39578 > 35.232.111.17.80: Flags [.], ack 1, win 64240, length 0
14:11:14.664684 08:00:27:a3:d0:17 > 52:54:00:12:35:02, ethertype IPv4 (0x0800), length 141: 10.0.2.15.39578 > 35.232.111.17.80: Flags [P.], seq 1:88, ack 1, win 64240, length 87: HTTP: GET / HTTP/1.1
14:11:14.665430 52:54:00:12:35:02 > 08:00:27:a3:d0:17, ethertype IPv4 (0x0800), length 60: 35.232.111.17.80 > 10.0.2.15.39578: Flags [.], ack 88, win 65535, length 0
14:11:14.953963 52:54:00:12:35:02 > 08:00:27:a3:d0:17, ethertype IPv4 (0x0800), length 202: 35.232.111.17.80 > 10.0.2.15.39578: Flags [P.], seq 1:149, ack 88, win 65535, length 148: HTTP: HTTP/1.1 204 No Content
14:11:14.953989 08:00:27:a3:d0:17 > 52:54:00:12:35:02, ethertype IPv4 (0x0800), length 54: 10.0.2.15.39578 > 35.232.111.17.80: Flags [.], ack 149, win 64092, length 0
14:11:14.954260 52:54:00:12:35:02 > 08:00:27:a3:d0:17, ethertype IPv4 (0x0800), length 60: 35.232.111.17.80 > 10.0.2.15.39578: Flags [F.], seq 149, ack 88, win 65535, length 0
14:11:14.954949 08:00:27:a3:d0:17 > 52:54:00:12:35:02, ethertype IPv4 (0x0800), length 54: 10.0.2.15.39578 > 35.232.111.17.80: Flags [F.], seq 88, ack 150, win 64091, length 0
14:11:14.957294 52:54:00:12:35:02 > 08:00:27:a3:d0:17, ethertype IPv4 (0x0800), length 60: 35.232.111.17.80 > 10.0.2.15.39578: Flags [.], ack 89, win 65535, length 0
14:14:44.260857 08:00:27:a3:d0:17 > 52:54:00:12:35:02, ethertype IPv4 (0x0800), length 100: 10.0.2.15.46607 > 172.31.1.130.53: 8601+ [1au] AAAA? connectivity-check.ubuntu.com. (58)
14:14:44.263406 52:54:00:12:35:02 > 08:00:27:a3:d0:17, ethertype IPv4 (0x0800), length 452: 172.31.1.130.53 > 10.0.2.15.46607: 8601 6/3/7 AAAA 2001:67c:1562::24, AAAA 2620:2d:4000:1::2b, AAAA 2620:2d:4000:1::2a, AAAA 2001:67c:1562::23, AAAA 2620:2d:4000:1::23, AAAA 2620:2d:4000:1::22 (410)
14:14:49.327254 08:00:27:a3:d0:17 > 52:54:00:12:35:02, ethertype ARP (0x0806), length 42: Request who-has 10.0.2.2 tell 10.0.2.15, length 28
14:14:49.328695 52:54:00:12:35:02 > 08:00:27:a3:d0:17, ethertype ARP (0x0806), length 60: Reply 10.0.2.2 is-at 52:54:00:12:35:02, length 46
14:16:14.761744 08:00:27:a3:d0:17 > 52:54:00:12:35:02, ethertype IPv4 (0x0800), length 100: 10.0.2.15.41470 > 172.31.1.130.53: 37027+ [1au] A? connectivity-check.ubuntu.com. (58)
14:16:14.763812 52:54:00:12:35:02 > 08:00:27:a3:d0:17, ethertype IPv4 (0x0800), length 428: 172.31.1.130.53 > 10.0.2.15.41470: 37027 9/3/7 A 185.125.190.48, A 35.224.170.84, A 91.189.91.49, A 35.232.111.17, A 34.122.121.32, A 185.125.190.18, A 91.189.91.48, A 185.125.190.17, A 185.125.190.49 (386)
14:16:14.771502 08:00:27:a3:d0:17 > 52:54:00:12:35:02, ethertype IPv4 (0x0800), length 74: 10.0.2.15.33876 > 185.125.190.48.80: Flags [S], seq 208195620, win 64240, options [mss 1460,sackOK,TS val 2595629861 ecr 0,nop,wscale 7], length 0
14:16:14.941029 52:54:00:12:35:02 > 08:00:27:a3:d0:17, ethertype IPv4 (0x0800), length 60: 185.125.190.48.80 > 10.0.2.15.33876: Flags [S.], seq 39808001, ack 208195621, win 65535, options [mss 1460], length 0
14:16:14.941110 08:00:27:a3:d0:17 > 52:54:00:12:35:02, ethertype IPv4 (0x0800), length 54: 10.0.2.15.33876 > 185.125.190.48.80: Flags [.], ack 1, win 64240, length 0
14:16:14.941283 08:00:27:a3:d0:17 > 52:54:00:12:35:02, ethertype IPv4 (0x0800), length 141: 10.0.2.15.33876 > 185.125.190.48.80: Flags [P.], seq 1:88, ack 1, win 64240, length 87: HTTP: GET / HTTP/1.1
14:16:14.941701 52:54:00:12:35:02 > 08:00:27:a3:d0:17, ethertype IPv4 (0x0800), length 60: 185.125.190.48.80 > 10.0.2.15.33876: Flags [.], ack 88, win 65535, length 0
14:16:15.111239 52:54:00:12:35:02 > 08:00:27:a3:d0:17, ethertype IPv4 (0x0800), length 243: 185.125.190.48.80 > 10.0.2.15.33876: Flags [P.], seq 1:190, ack 88, win 65535, length 189: HTTP: HTTP/1.1 204 No Content
14:16:15.111260 08:00:27:a3:d0:17 > 52:54:00:12:35:02, ethertype IPv4 (0x0800), length 54: 10.0.2.15.33876 > 185.125.190.48.80: Flags [.], ack 190, win 64051, length 0
14:16:15.111445 52:54:00:12:35:02 > 08:00:27:a3:d0:17, ethertype IPv4 (0x0800), length 60: 185.125.190.48.80 > 10.0.2.15.33876: Flags [F.], seq 190, ack 88, win 65535, length 0
14:16:15.111907 08:00:27:a3:d0:17 > 52:54:00:12:35:02, ethertype IPv4 (0x0800), length 54: 10.0.2.15.33876 > 185.125.190.48.80: Flags [F.], seq 88, ack 191, win 64051, length 0
14:16:15.112209 52:54:00:12:35:02 > 08:00:27:a3:d0:17, ethertype IPv4 (0x0800), length 60: 185.125.190.48.80 > 10.0.2.15.33876: Flags [.], ack 89, win 65535, length 0
14:19:44.331645 08:00:27:a3:d0:17 > 52:54:00:12:35:02, ethertype IPv4 (0x0800), length 100: 10.0.2.15.42487 > 172.31.1.130.53: 44303+ [1au] AAAA? connectivity-check.ubuntu.com. (58)
14:19:44.334069 52:54:00:12:35:02 > 08:00:27:a3:d0:17, ethertype IPv4 (0x0800), length 452: 172.31.1.130.53 > 10.0.2.15.42487: 44303 6/3/7 AAAA 2620:2d:4000:1::2b, AAAA 2620:2d:4000:1::22, AAAA 2620:2d:4000:1::23, AAAA 2620:2d:4000:1::2a, AAAA 2001:67c:1562::24, AAAA 2001:67c:1562::23 (410)
14:19:49.508121 08:00:27:a3:d0:17 > 52:54:00:12:35:02, ethertype ARP (0x0806), length 42: Request who-has 10.0.2.2 tell 10.0.2.15, length 28
14:19:49.512773 52:54:00:12:35:02 > 08:00:27:a3:d0:17, ethertype ARP (0x0806), length 60: Reply 10.0.2.2 is-at 52:54:00:12:35:02, length 46
14:21:14.302260 08:00:27:a3:d0:17 > 52:54:00:12:35:02, ethertype IPv4 (0x0800), length 100: 10.0.2.15.38647 > 172.31.1.130.53: 45650+ [1au] A? connectivity-check.ubuntu.com. (58)
14:21:14.304436 52:54:00:12:35:02 > 08:00:27:a3:d0:17, ethertype IPv4 (0x0800), length 428: 172.31.1.130.53 > 10.0.2.15.38647: 45650 9/3/7 A 91.189.91.48, A 185.125.190.18, A 185.125.190.17, A 185.125.190.49, A 34.122.121.32, A 91.189.91.49, A 185.125.190.48, A 35.232.111.17, A 35.224.170.84 (386)
14:21:14.305687 08:00:27:a3:d0:17 > 52:54:00:12:35:02, ethertype IPv4 (0x0800), length 74: 10.0.2.15.58786 > 91.189.91.48.80: Flags [S], seq 2672490913, win 64240, options [mss 1460,sackOK,TS val 459412262 ecr 0,nop,wscale 7], length 0
14:21:14.627876 52:54:00:12:35:02 > 08:00:27:a3:d0:17, ethertype IPv4 (0x0800), length 60: 91.189.91.48.80 > 10.0.2.15.58786: Flags [S.], seq 41216001, ack 2672490914, win 65535, options [mss 1460], length 0
14:21:14.627915 08:00:27:a3:d0:17 > 52:54:00:12:35:02, ethertype IPv4 (0x0800), length 54: 10.0.2.15.58786 > 91.189.91.48.80: Flags [.], ack 1, win 64240, length 0
14:21:14.629010 08:00:27:a3:d0:17 > 52:54:00:12:35:02, ethertype IPv4 (0x0800), length 141: 10.0.2.15.58786 > 91.189.91.48.80: Flags [P.], seq 1:88, ack 1, win 64240, length 87: HTTP: GET / HTTP/1.1
14:21:14.630307 52:54:00:12:35:02 > 08:00:27:a3:d0:17, ethertype IPv4 (0x0800), length 60: 91.189.91.48.80 > 10.0.2.15.58786: Flags [.], ack 88, win 65535, length 0
14:21:14.951590 52:54:00:12:35:02 > 08:00:27:a3:d0:17, ethertype IPv4 (0x0800), length 243: 91.189.91.48.80 > 10.0.2.15.58786: Flags [P.], seq 1:190, ack 88, win 65535, length 189: HTTP: HTTP/1.1 204 No Content
14:21:14.951612 08:00:27:a3:d0:17 > 52:54:00:12:35:02, ethertype IPv4 (0x0800), length 54: 10.0.2.15.58786 > 91.189.91.48.80: Flags [.], ack 190, win 64051, length 0
14:21:14.951706 52:54:00:12:35:02 > 08:00:27:a3:d0:17, ethertype IPv4 (0x0800), length 60: 91.189.91.48.80 > 10.0.2.15.58786: Flags [F.], seq 190, ack 88, win 65535, length 0
14:21:14.952660 08:00:27:a3:d0:17 > 52:54:00:12:35:02, ethertype IPv4 (0x0800), length 54: 10.0.2.15.58786 > 91.189.91.48.80: Flags [F.], seq 88, ack 191, win 64051, length 0
14:21:14.953770 52:54:00:12:35:02 > 08:00:27:a3:d0:17, ethertype IPv4 (0x0800), length 60: 91.189.91.48.80 > 10.0.2.15.58786: Flags [.], ack 89, win 65535, length 0
14:24:44.406065 08:00:27:a3:d0:17 > 52:54:00:12:35:02, ethertype IPv4 (0x0800), length 100: 10.0.2.15.36687 > 172.31.1.130.53: 30380+ [1au] AAAA? connectivity-check.ubuntu.com. (58)
14:24:44.413232 52:54:00:12:35:02 > 08:00:27:a3:d0:17, ethertype IPv4 (0x0800), length 452: 172.31.1.130.53 > 10.0.2.15.36687: 30380 6/3/7 AAAA 2620:2d:4000:1::2a, AAAA 2001:67c:1562::24, AAAA 2620:2d:4000:1::23, AAAA 2620:2d:4000:1::2b, AAAA 2001:67c:1562::23, AAAA 2620:2d:4000:1::22 (410)
14:24:49.933519 08:00:27:a3:d0:17 > 52:54:00:12:35:02, ethertype ARP (0x0806), length 42: Request who-has 10.0.2.2 tell 10.0.2.15, length 28
14:24:49.933953 52:54:00:12:35:02 > 08:00:27:a3:d0:17, ethertype ARP (0x0806), length 60: Reply 10.0.2.2 is-at 52:54:00:12:35:02, length 46
14:26:14.356095 08:00:27:a3:d0:17 > 52:54:00:12:35:02, ethertype IPv4 (0x0800), length 100: 10.0.2.15.51731 > 172.31.1.130.53: 45231+ [1au] A? connectivity-check.ubuntu.com. (58)
14:26:14.357930 52:54:00:12:35:02 > 08:00:27:a3:d0:17, ethertype IPv4 (0x0800), length 428: 172.31.1.130.53 > 10.0.2.15.51731: 45231 9/3/7 A 185.125.190.18, A 185.125.190.48, A 35.232.111.17, A 34.122.121.32, A 185.125.190.17, A 91.189.91.49, A 35.224.170.84, A 91.189.91.48, A 185.125.190.49 (386)
14:26:14.360572 08:00:27:a3:d0:17 > 52:54:00:12:35:02, ethertype IPv4 (0x0800), length 74: 10.0.2.15.43166 > 185.125.190.18.80: Flags [S], seq 3102748204, win 64240, options [mss 1460,sackOK,TS val 3829490865 ecr 0,nop,wscale 7], length 0
14:26:14.515997 52:54:00:12:35:02 > 08:00:27:a3:d0:17, ethertype IPv4 (0x0800), length 60: 185.125.190.18.80 > 10.0.2.15.43166: Flags [S.], seq 42624001, ack 3102748205, win 65535, options [mss 1460], length 0
14:26:14.516143 08:00:27:a3:d0:17 > 52:54:00:12:35:02, ethertype IPv4 (0x0800), length 54: 10.0.2.15.43166 > 185.125.190.18.80: Flags [.], ack 1, win 64240, length 0
14:26:14.516728 08:00:27:a3:d0:17 > 52:54:00:12:35:02, ethertype IPv4 (0x0800), length 141: 10.0.2.15.43166 > 185.125.190.18.80: Flags [P.], seq 1:88, ack 1, win 64240, length 87: HTTP: GET / HTTP/1.1
14:26:14.518483 52:54:00:12:35:02 > 08:00:27:a3:d0:17, ethertype IPv4 (0x0800), length 60: 185.125.190.18.80 > 10.0.2.15.43166: Flags [.], ack 88, win 65535, length 0
14:26:14.673120 52:54:00:12:35:02 > 08:00:27:a3:d0:17, ethertype IPv4 (0x0800), length 243: 185.125.190.18.80 > 10.0.2.15.43166: Flags [P.], seq 1:190, ack 88, win 65535, length 189: HTTP: HTTP/1.1 204 No Content
14:26:14.673141 08:00:27:a3:d0:17 > 52:54:00:12:35:02, ethertype IPv4 (0x0800), length 54: 10.0.2.15.43166 > 185.125.190.18.80: Flags [.], ack 190, win 64051, length 0
14:26:14.673380 52:54:00:12:35:02 > 08:00:27:a3:d0:17, ethertype IPv4 (0x0800), length 60: 185.125.190.18.80 > 10.0.2.15.43166: Flags [F.], seq 190, ack 88, win 65535, length 0
14:26:14.673750 08:00:27:a3:d0:17 > 52:54:00:12:35:02, ethertype IPv4 (0x0800), length 54: 10.0.2.15.43166 > 185.125.190.18.80: Flags [F.], seq 88, ack 191, win 64051, length 0
14:26:14.674554 52:54:00:12:35:02 > 08:00:27:a3:d0:17, ethertype IPv4 (0x0800), length 60: 185.125.190.18.80 > 10.0.2.15.43166: Flags [.], ack 89, win 65535, length 0
14:26:19.930070 08:00:27:a3:d0:17 > 52:54:00:12:35:02, ethertype ARP (0x0806), length 42: Request who-has 10.0.2.2 tell 10.0.2.15, length 28
14:26:19.937966 52:54:00:12:35:02 > 08:00:27:a3:d0:17, ethertype ARP (0x0806), length 60: Reply 10.0.2.2 is-at 52:54:00:12:35:02, length 46
14:29:44.995933 08:00:27:a3:d0:17 > 52:54:00:12:35:02, ethertype IPv4 (0x0800), length 100: 10.0.2.15.39595 > 172.31.1.130.53: 2768+ [1au] AAAA? connectivity-check.ubuntu.com. (58)
14:29:44.999353 52:54:00:12:35:02 > 08:00:27:a3:d0:17, ethertype IPv4 (0x0800), length 452: 172.31.1.130.53 > 10.0.2.15.39595: 2768 6/3/7 AAAA 2620:2d:4000:1::23, AAAA 2001:67c:1562::23, AAAA 2620:2d:4000:1::2a, AAAA 2620:2d:4000:1::2b, AAAA 2001:67c:1562::24, AAAA 2620:2d:4000:1::22 (410)
14:29:50.272333 08:00:27:a3:d0:17 > 52:54:00:12:35:02, ethertype ARP (0x0806), length 42: Request who-has 10.0.2.2 tell 10.0.2.15, length 28
14:29:50.275375 52:54:00:12:35:02 > 08:00:27:a3:d0:17, ethertype ARP (0x0806), length 60: Reply 10.0.2.2 is-at 52:54:00:12:35:02, length 46
14:31:14.371118 08:00:27:a3:d0:17 > 52:54:00:12:35:02, ethertype IPv4 (0x0800), length 100: 10.0.2.15.60235 > 172.31.1.130.53: 9246+ [1au] A? connectivity-check.ubuntu.com. (58)
14:31:14.373453 52:54:00:12:35:02 > 08:00:27:a3:d0:17, ethertype IPv4 (0x0800), length 428: 172.31.1.130.53 > 10.0.2.15.60235: 9246 9/3/7 A 91.189.91.48, A 35.232.111.17, A 185.125.190.49, A 185.125.190.48, A 185.125.190.17, A 91.189.91.49, A 35.224.170.84, A 185.125.190.18, A 34.122.121.32 (386)
14:31:14.374724 08:00:27:a3:d0:17 > 52:54:00:12:35:02, ethertype IPv4 (0x0800), length 74: 10.0.2.15.47554 > 91.189.91.48.80: Flags [S], seq 2393073619, win 64240, options [mss 1460,sackOK,TS val 460012331 ecr 0,nop,wscale 7], length 0
14:31:14.720113 52:54:00:12:35:02 > 08:00:27:a3:d0:17, ethertype IPv4 (0x0800), length 60: 91.189.91.48.80 > 10.0.2.15.47554: Flags [S.], seq 44032001, ack 2393073620, win 65535, options [mss 1460], length 0
14:31:14.720223 08:00:27:a3:d0:17 > 52:54:00:12:35:02, ethertype IPv4 (0x0800), length 54: 10.0.2.15.47554 > 91.189.91.48.80: Flags [.], ack 1, win 64240, length 0
14:31:14.720511 08:00:27:a3:d0:17 > 52:54:00:12:35:02, ethertype IPv4 (0x0800), length 141: 10.0.2.15.47554 > 91.189.91.48.80: Flags [P.], seq 1:88, ack 1, win 64240, length 87: HTTP: GET / HTTP/1.1
14:31:14.721020 52:54:00:12:35:02 > 08:00:27:a3:d0:17, ethertype IPv4 (0x0800), length 60: 91.189.91.48.80 > 10.0.2.15.47554: Flags [.], ack 88, win 65535, length 0
14:31:15.066241 52:54:00:12:35:02 > 08:00:27:a3:d0:17, ethertype IPv4 (0x0800), length 243: 91.189.91.48.80 > 10.0.2.15.47554: Flags [P.], seq 1:190, ack 88, win 65535, length 189: HTTP: HTTP/1.1 204 No Content
14:31:15.066260 08:00:27:a3:d0:17 > 52:54:00:12:35:02, ethertype IPv4 (0x0800), length 54: 10.0.2.15.47554 > 91.189.91.48.80: Flags [.], ack 190, win 64051, length 0
14:31:15.067286 52:54:00:12:35:02 > 08:00:27:a3:d0:17, ethertype IPv4 (0x0800), length 60: 91.189.91.48.80 > 10.0.2.15.47554: Flags [F.], seq 190, ack 88, win 65535, length 0
14:31:15.069284 08:00:27:a3:d0:17 > 52:54:00:12:35:02, ethertype IPv4 (0x0800), length 54: 10.0.2.15.47554 > 91.189.91.48.80: Flags [F.], seq 88, ack 191, win 64051, length 0
14:31:15.069557 52:54:00:12:35:02 > 08:00:27:a3:d0:17, ethertype IPv4 (0x0800), length 60: 91.189.91.48.80 > 10.0.2.15.47554: Flags [.], ack 89, win 65535, length 0
14:34:44.265513 08:00:27:a3:d0:17 > 52:54:00:12:35:02, ethertype IPv4 (0x0800), length 100: 10.0.2.15.34861 > 172.31.1.130.53: 40680+ [1au] AAAA? connectivity-check.ubuntu.com. (58)
14:34:44.273827 52:54:00:12:35:02 > 08:00:27:a3:d0:17, ethertype IPv4 (0x0800), length 452: 172.31.1.130.53 > 10.0.2.15.34861: 40680 6/3/7 AAAA 2001:67c:1562::23, AAAA 2620:2d:4000:1::22, AAAA 2620:2d:4000:1::2a, AAAA 2001:67c:1562::24, AAAA 2620:2d:4000:1::2b, AAAA 2620:2d:4000:1::23 (410)
14:34:49.474331 08:00:27:a3:d0:17 > 52:54:00:12:35:02, ethertype ARP (0x0806), length 42: Request who-has 10.0.2.2 tell 10.0.2.15, length 28
14:34:49.475290 52:54:00:12:35:02 > 08:00:27:a3:d0:17, ethertype ARP (0x0806), length 60: Reply 10.0.2.2 is-at 52:54:00:12:35:02, length 46
14:36:14.254351 08:00:27:a3:d0:17 > 52:54:00:12:35:02, ethertype IPv4 (0x0800), length 100: 10.0.2.15.36679 > 172.31.1.130.53: 14852+ [1au] A? connectivity-check.ubuntu.com. (58)
14:36:14.262657 52:54:00:12:35:02 > 08:00:27:a3:d0:17, ethertype IPv4 (0x0800), length 428: 172.31.1.130.53 > 10.0.2.15.36679: 14852 9/3/7 A 35.232.111.17, A 185.125.190.18, A 91.189.91.48, A 185.125.190.48, A 185.125.190.17, A 91.189.91.49, A 185.125.190.49, A 35.224.170.84, A 34.122.121.32 (386)
14:36:14.265449 08:00:27:a3:d0:17 > 52:54:00:12:35:02, ethertype IPv4 (0x0800), length 74: 10.0.2.15.58410 > 35.232.111.17.80: Flags [S], seq 3549472788, win 64240, options [mss 1460,sackOK,TS val 3248614209 ecr 0,nop,wscale 7], length 0
14:36:14.551066 52:54:00:12:35:02 > 08:00:27:a3:d0:17, ethertype IPv4 (0x0800), length 60: 35.232.111.17.80 > 10.0.2.15.58410: Flags [S.], seq 45440001, ack 3549472789, win 65535, options [mss 1460], length 0
14:36:14.551267 08:00:27:a3:d0:17 > 52:54:00:12:35:02, ethertype IPv4 (0x0800), length 54: 10.0.2.15.58410 > 35.232.111.17.80: Flags [.], ack 1, win 64240, length 0
14:36:14.551832 08:00:27:a3:d0:17 > 52:54:00:12:35:02, ethertype IPv4 (0x0800), length 141: 10.0.2.15.58410 > 35.232.111.17.80: Flags [P.], seq 1:88, ack 1, win 64240, length 87: HTTP: GET / HTTP/1.1
14:36:14.552185 52:54:00:12:35:02 > 08:00:27:a3:d0:17, ethertype IPv4 (0x0800), length 60: 35.232.111.17.80 > 10.0.2.15.58410: Flags [.], ack 88, win 65535, length 0
14:36:14.836824 52:54:00:12:35:02 > 08:00:27:a3:d0:17, ethertype IPv4 (0x0800), length 202: 35.232.111.17.80 > 10.0.2.15.58410: Flags [P.], seq 1:149, ack 88, win 65535, length 148: HTTP: HTTP/1.1 204 No Content
14:36:14.836845 08:00:27:a3:d0:17 > 52:54:00:12:35:02, ethertype IPv4 (0x0800), length 54: 10.0.2.15.58410 > 35.232.111.17.80: Flags [.], ack 149, win 64092, length 0
14:36:14.837522 08:00:27:a3:d0:17 > 52:54:00:12:35:02, ethertype IPv4 (0x0800), length 54: 10.0.2.15.58410 > 35.232.111.17.80: Flags [F.], seq 88, ack 149, win 64092, length 0
14:36:14.845202 52:54:00:12:35:02 > 08:00:27:a3:d0:17, ethertype IPv4 (0x0800), length 60: 35.232.111.17.80 > 10.0.2.15.58410: Flags [.], ack 89, win 65535, length 0
14:36:14.845236 52:54:00:12:35:02 > 08:00:27:a3:d0:17, ethertype IPv4 (0x0800), length 60: 35.232.111.17.80 > 10.0.2.15.58410: Flags [F.], seq 149, ack 89, win 65535, length 0
14:36:14.845252 08:00:27:a3:d0:17 > 52:54:00:12:35:02, ethertype IPv4 (0x0800), length 54: 10.0.2.15.58410 > 35.232.111.17.80: Flags [.], ack 150, win 64092, length 0
14:38:09.794046 08:00:27:a3:d0:17 > 33:33:00:00:00:02, ethertype IPv6 (0x86dd), length 62: fe80::b1a5:303c:d7b8:5b3f > ff02::2: ICMP6, router solicitation, length 8
14:39:29.746247 08:00:27:a3:d0:17 > 33:33:00:00:00:fb, ethertype IPv6 (0x86dd), length 107: fe80::b1a5:303c:d7b8:5b3f.5353 > ff02::fb.5353: 0 [2q] PTR (QM)? _ipp._tcp.local. PTR (QM)? _ipps._tcp.local. (45)
14:39:29.746382 08:00:27:a3:d0:17 > 01:00:5e:00:00:fb, ethertype IPv4 (0x0800), length 87: 10.0.2.15.5353 > 224.0.0.251.5353: 0 [2q] PTR (QM)? _ipp._tcp.local. PTR (QM)? _ipps._tcp.local. (45)
14:39:44.337419 08:00:27:a3:d0:17 > 52:54:00:12:35:02, ethertype IPv4 (0x0800), length 100: 10.0.2.15.47806 > 172.31.1.130.53: 34470+ [1au] AAAA? connectivity-check.ubuntu.com. (58)
14:39:44.339354 52:54:00:12:35:02 > 08:00:27:a3:d0:17, ethertype IPv4 (0x0800), length 452: 172.31.1.130.53 > 10.0.2.15.47806: 34470 6/3/7 AAAA 2620:2d:4000:1::23, AAAA 2620:2d:4000:1::2b, AAAA 2001:67c:1562::23, AAAA 2620:2d:4000:1::22, AAAA 2620:2d:4000:1::2a, AAAA 2001:67c:1562::24 (410)
14:39:49.467494 08:00:27:a3:d0:17 > 52:54:00:12:35:02, ethertype ARP (0x0806), length 42: Request who-has 10.0.2.2 tell 10.0.2.15, length 28
14:39:49.467948 52:54:00:12:35:02 > 08:00:27:a3:d0:17, ethertype ARP (0x0806), length 60: Reply 10.0.2.2 is-at 52:54:00:12:35:02, length 46
14:40:10.723522 08:00:27:a3:d0:17 > 33:33:00:00:00:fb, ethertype IPv6 (0x86dd), length 180: fe80::b1a5:303c:d7b8:5b3f.5353 > ff02::fb.5353: 0 [7q] PTR (QM)? _ftp._tcp.local. PTR (QM)? _nfs._tcp.local. PTR (QM)? _afpovertcp._tcp.local. PTR (QM)? _smb._tcp.local. PTR (QM)? _sftp-ssh._tcp.local. PTR (QM)? _webdavs._tcp.local. PTR (QM)? _webdav._tcp.local. (118)
14:40:10.723675 08:00:27:a3:d0:17 > 01:00:5e:00:00:fb, ethertype IPv4 (0x0800), length 160: 10.0.2.15.5353 > 224.0.0.251.5353: 0 [7q] PTR (QM)? _ftp._tcp.local. PTR (QM)? _nfs._tcp.local. PTR (QM)? _afpovertcp._tcp.local. PTR (QM)? _smb._tcp.local. PTR (QM)? _sftp-ssh._tcp.local. PTR (QM)? _webdavs._tcp.local. PTR (QM)? _webdav._tcp.local. (118)
14:41:14.327775 08:00:27:a3:d0:17 > 52:54:00:12:35:02, ethertype IPv4 (0x0800), length 100: 10.0.2.15.36460 > 172.31.1.130.53: 52402+ [1au] A? connectivity-check.ubuntu.com. (58)
14:41:14.531692 52:54:00:12:35:02 > 08:00:27:a3:d0:17, ethertype IPv4 (0x0800), length 428: 172.31.1.130.53 > 10.0.2.15.36460: 52402 9/3/7 A 185.125.190.49, A 35.224.170.84, A 185.125.190.18, A 35.232.111.17, A 185.125.190.48, A 91.189.91.48, A 34.122.121.32, A 91.189.91.49, A 185.125.190.17 (386)
14:41:14.534071 08:00:27:a3:d0:17 > 52:54:00:12:35:02, ethertype IPv4 (0x0800), length 74: 10.0.2.15.40798 > 185.125.190.49.80: Flags [S], seq 2311087855, win 64240, options [mss 1460,sackOK,TS val 1193047112 ecr 0,nop,wscale 7], length 0
14:41:14.862941 52:54:00:12:35:02 > 08:00:27:a3:d0:17, ethertype IPv4 (0x0800), length 60: 185.125.190.49.80 > 10.0.2.15.40798: Flags [S.], seq 45568001, ack 2311087856, win 65535, options [mss 1460], length 0
14:41:14.863052 08:00:27:a3:d0:17 > 52:54:00:12:35:02, ethertype IPv4 (0x0800), length 54: 10.0.2.15.40798 > 185.125.190.49.80: Flags [.], ack 1, win 64240, length 0
14:41:14.863257 08:00:27:a3:d0:17 > 52:54:00:12:35:02, ethertype IPv4 (0x0800), length 141: 10.0.2.15.40798 > 185.125.190.49.80: Flags [P.], seq 1:88, ack 1, win 64240, length 87: HTTP: GET / HTTP/1.1
14:41:14.864037 52:54:00:12:35:02 > 08:00:27:a3:d0:17, ethertype IPv4 (0x0800), length 60: 185.125.190.49.80 > 10.0.2.15.40798: Flags [.], ack 88, win 65535, length 0
14:41:16.971947 52:54:00:12:35:02 > 08:00:27:a3:d0:17, ethertype IPv4 (0x0800), length 243: 185.125.190.49.80 > 10.0.2.15.40798: Flags [P.], seq 1:190, ack 88, win 65535, length 189: HTTP: HTTP/1.1 204 No Content
14:41:16.972355 08:00:27:a3:d0:17 > 52:54:00:12:35:02, ethertype IPv4 (0x0800), length 54: 10.0.2.15.40798 > 185.125.190.49.80: Flags [.], ack 190, win 64051, length 0
14:41:16.973092 52:54:00:12:35:02 > 08:00:27:a3:d0:17, ethertype IPv4 (0x0800), length 60: 185.125.190.49.80 > 10.0.2.15.40798: Flags [F.], seq 190, ack 88, win 65535, length 0
14:41:16.973131 08:00:27:a3:d0:17 > 52:54:00:12:35:02, ethertype IPv4 (0x0800), length 54: 10.0.2.15.40798 > 185.125.190.49.80: Flags [F.], seq 88, ack 191, win 64051, length 0
14:41:16.973813 52:54:00:12:35:02 > 08:00:27:a3:d0:17, ethertype IPv4 (0x0800), length 60: 185.125.190.49.80 > 10.0.2.15.40798: Flags [.], ack 89, win 65535, length 0
14:43:46.524869 08:00:27:a3:d0:17 > 52:54:00:12:35:02, ethertype IPv4 (0x0800), length 90: 10.0.2.15.38444 > 185.125.190.57.123: NTPv4, Client, length 48
14:43:46.732478 52:54:00:12:35:02 > 08:00:27:a3:d0:17, ethertype IPv4 (0x0800), length 90: 185.125.190.57.123 > 10.0.2.15.38444: NTPv4, Server, length 48
14:43:51.701122 08:00:27:a3:d0:17 > 52:54:00:12:35:02, ethertype ARP (0x0806), length 42: Request who-has 10.0.2.2 tell 10.0.2.15, length 28
14:43:51.704780 52:54:00:12:35:02 > 08:00:27:a3:d0:17, ethertype ARP (0x0806), length 60: Reply 10.0.2.2 is-at 52:54:00:12:35:02, length 46
14:44:44.252944 08:00:27:a3:d0:17 > 52:54:00:12:35:02, ethertype IPv4 (0x0800), length 100: 10.0.2.15.46481 > 172.31.1.130.53: 48465+ [1au] AAAA? connectivity-check.ubuntu.com. (58)
14:44:44.254955 52:54:00:12:35:02 > 08:00:27:a3:d0:17, ethertype IPv4 (0x0800), length 452: 172.31.1.130.53 > 10.0.2.15.46481: 48465 6/3/7 AAAA 2620:2d:4000:1::23, AAAA 2620:2d:4000:1::22, AAAA 2620:2d:4000:1::2a, AAAA 2620:2d:4000:1::2b, AAAA 2001:67c:1562::23, AAAA 2001:67c:1562::24 (410)
14:44:49.522543 08:00:27:a3:d0:17 > 52:54:00:12:35:02, ethertype ARP (0x0806), length 42: Request who-has 10.0.2.2 tell 10.0.2.15, length 28
14:44:49.523117 52:54:00:12:35:02 > 08:00:27:a3:d0:17, ethertype ARP (0x0806), length 60: Reply 10.0.2.2 is-at 52:54:00:12:35:02, length 46
14:46:14.317884 08:00:27:a3:d0:17 > 52:54:00:12:35:02, ethertype IPv4 (0x0800), length 100: 10.0.2.15.40761 > 172.31.1.130.53: 31775+ [1au] A? connectivity-check.ubuntu.com. (58)
14:46:14.320389 52:54:00:12:35:02 > 08:00:27:a3:d0:17, ethertype IPv4 (0x0800), length 428: 172.31.1.130.53 > 10.0.2.15.40761: 31775 9/3/7 A 91.189.91.48, A 35.232.111.17, A 185.125.190.48, A 35.224.170.84, A 185.125.190.17, A 34.122.121.32, A 91.189.91.49, A 185.125.190.49, A 185.125.190.18 (386)
14:46:14.321574 08:00:27:a3:d0:17 > 52:54:00:12:35:02, ethertype IPv4 (0x0800), length 74: 10.0.2.15.49954 > 91.189.91.48.80: Flags [S], seq 1192913319, win 64240, options [mss 1460,sackOK,TS val 460912278 ecr 0,nop,wscale 7], length 0
14:46:14.658163 52:54:00:12:35:02 > 08:00:27:a3:d0:17, ethertype IPv4 (0x0800), length 60: 91.189.91.48.80 > 10.0.2.15.49954: Flags [S.], seq 47232001, ack 1192913320, win 65535, options [mss 1460], length 0
14:46:14.658313 08:00:27:a3:d0:17 > 52:54:00:12:35:02, ethertype IPv4 (0x0800), length 54: 10.0.2.15.49954 > 91.189.91.48.80: Flags [.], ack 1, win 64240, length 0
14:46:14.659423 08:00:27:a3:d0:17 > 52:54:00:12:35:02, ethertype IPv4 (0x0800), length 141: 10.0.2.15.49954 > 91.189.91.48.80: Flags [P.], seq 1:88, ack 1, win 64240, length 87: HTTP: GET / HTTP/1.1
14:46:14.660255 52:54:00:12:35:02 > 08:00:27:a3:d0:17, ethertype IPv4 (0x0800), length 60: 91.189.91.48.80 > 10.0.2.15.49954: Flags [.], ack 88, win 65535, length 0
14:46:14.996400 52:54:00:12:35:02 > 08:00:27:a3:d0:17, ethertype IPv4 (0x0800), length 243: 91.189.91.48.80 > 10.0.2.15.49954: Flags [P.], seq 1:190, ack 88, win 65535, length 189: HTTP: HTTP/1.1 204 No Content
14:46:14.996450 08:00:27:a3:d0:17 > 52:54:00:12:35:02, ethertype IPv4 (0x0800), length 54: 10.0.2.15.49954 > 91.189.91.48.80: Flags [.], ack 190, win 64051, length 0
14:46:14.996631 52:54:00:12:35:02 > 08:00:27:a3:d0:17, ethertype IPv4 (0x0800), length 60: 91.189.91.48.80 > 10.0.2.15.49954: Flags [F.], seq 190, ack 88, win 65535, length 0
14:46:14.997786 08:00:27:a3:d0:17 > 52:54:00:12:35:02, ethertype IPv4 (0x0800), length 54: 10.0.2.15.49954 > 91.189.91.48.80: Flags [F.], seq 88, ack 191, win 64051, length 0
14:46:15.002060 52:54:00:12:35:02 > 08:00:27:a3:d0:17, ethertype IPv4 (0x0800), length 60: 91.189.91.48.80 > 10.0.2.15.49954: Flags [.], ack 89, win 65535, length 0
14:49:44.339078 08:00:27:a3:d0:17 > 52:54:00:12:35:02, ethertype IPv4 (0x0800), length 100: 10.0.2.15.54458 > 172.31.1.130.53: 34435+ [1au] AAAA? connectivity-check.ubuntu.com. (58)
14:49:44.482294 52:54:00:12:35:02 > 08:00:27:a3:d0:17, ethertype IPv4 (0x0800), length 452: 172.31.1.130.53 > 10.0.2.15.54458: 34435 6/3/7 AAAA 2620:2d:4000:1::2a, AAAA 2001:67c:1562::24, AAAA 2620:2d:4000:1::23, AAAA 2001:67c:1562::23, AAAA 2620:2d:4000:1::22, AAAA 2620:2d:4000:1::2b (410)
14:49:49.626160 08:00:27:a3:d0:17 > 52:54:00:12:35:02, ethertype ARP (0x0806), length 42: Request who-has 10.0.2.2 tell 10.0.2.15, length 28
14:49:49.626629 52:54:00:12:35:02 > 08:00:27:a3:d0:17, ethertype ARP (0x0806), length 60: Reply 10.0.2.2 is-at 52:54:00:12:35:02, length 46
14:51:14.275151 08:00:27:a3:d0:17 > 52:54:00:12:35:02, ethertype IPv4 (0x0800), length 100: 10.0.2.15.48325 > 172.31.1.130.53: 4716+ [1au] A? connectivity-check.ubuntu.com. (58)
14:51:14.280497 52:54:00:12:35:02 > 08:00:27:a3:d0:17, ethertype IPv4 (0x0800), length 428: 172.31.1.130.53 > 10.0.2.15.48325: 4716 9/3/7 A 185.125.190.17, A 91.189.91.49, A 185.125.190.48, A 91.189.91.48, A 35.224.170.84, A 35.232.111.17, A 185.125.190.18, A 34.122.121.32, A 185.125.190.49 (386)
14:51:14.285699 08:00:27:a3:d0:17 > 52:54:00:12:35:02, ethertype IPv4 (0x0800), length 74: 10.0.2.15.57396 > 185.125.190.17.80: Flags [S], seq 3387506693, win 64240, options [mss 1460,sackOK,TS val 3874930975 ecr 0,nop,wscale 7], length 0
14:51:14.470656 52:54:00:12:35:02 > 08:00:27:a3:d0:17, ethertype IPv4 (0x0800), length 60: 185.125.190.17.80 > 10.0.2.15.57396: Flags [S.], seq 48640001, ack 3387506694, win 65535, options [mss 1460], length 0
14:51:14.470701 08:00:27:a3:d0:17 > 52:54:00:12:35:02, ethertype IPv4 (0x0800), length 54: 10.0.2.15.57396 > 185.125.190.17.80: Flags [.], ack 1, win 64240, length 0
14:51:14.471671 08:00:27:a3:d0:17 > 52:54:00:12:35:02, ethertype IPv4 (0x0800), length 141: 10.0.2.15.57396 > 185.125.190.17.80: Flags [P.], seq 1:88, ack 1, win 64240, length 87: HTTP: GET / HTTP/1.1
14:51:14.473525 52:54:00:12:35:02 > 08:00:27:a3:d0:17, ethertype IPv4 (0x0800), length 60: 185.125.190.17.80 > 10.0.2.15.57396: Flags [.], ack 88, win 65535, length 0
14:51:14.656980 52:54:00:12:35:02 > 08:00:27:a3:d0:17, ethertype IPv4 (0x0800), length 243: 185.125.190.17.80 > 10.0.2.15.57396: Flags [P.], seq 1:190, ack 88, win 65535, length 189: HTTP: HTTP/1.1 204 No Content
14:51:14.657000 08:00:27:a3:d0:17 > 52:54:00:12:35:02, ethertype IPv4 (0x0800), length 54: 10.0.2.15.57396 > 185.125.190.17.80: Flags [.], ack 190, win 64051, length 0
14:51:14.657350 08:00:27:a3:d0:17 > 52:54:00:12:35:02, ethertype IPv4 (0x0800), length 54: 10.0.2.15.57396 > 185.125.190.17.80: Flags [F.], seq 88, ack 190, win 64051, length 0
14:51:14.659329 52:54:00:12:35:02 > 08:00:27:a3:d0:17, ethertype IPv4 (0x0800), length 60: 185.125.190.17.80 > 10.0.2.15.57396: Flags [F.], seq 190, ack 88, win 65535, length 0
14:51:14.659338 08:00:27:a3:d0:17 > 52:54:00:12:35:02, ethertype IPv4 (0x0800), length 54: 10.0.2.15.57396 > 185.125.190.17.80: Flags [.], ack 191, win 64051, length 0
14:51:14.659406 52:54:00:12:35:02 > 08:00:27:a3:d0:17, ethertype IPv4 (0x0800), length 60: 185.125.190.17.80 > 10.0.2.15.57396: Flags [F.], seq 190, ack 89, win 65535, length 0
14:54:44.413333 08:00:27:a3:d0:17 > 52:54:00:12:35:02, ethertype IPv4 (0x0800), length 100: 10.0.2.15.34275 > 172.31.1.130.53: 62867+ [1au] AAAA? connectivity-check.ubuntu.com. (58)
14:54:44.416940 52:54:00:12:35:02 > 08:00:27:a3:d0:17, ethertype IPv4 (0x0800), length 452: 172.31.1.130.53 > 10.0.2.15.34275: 62867 6/3/7 AAAA 2620:2d:4000:1::23, AAAA 2001:67c:1562::24, AAAA 2001:67c:1562::23, AAAA 2620:2d:4000:1::2b, AAAA 2620:2d:4000:1::22, AAAA 2620:2d:4000:1::2a (410)
14:54:50.056521 08:00:27:a3:d0:17 > 52:54:00:12:35:02, ethertype ARP (0x0806), length 42: Request who-has 10.0.2.2 tell 10.0.2.15, length 28
14:54:50.057918 52:54:00:12:35:02 > 08:00:27:a3:d0:17, ethertype ARP (0x0806), length 60: Reply 10.0.2.2 is-at 52:54:00:12:35:02, length 46
14:56:14.336511 08:00:27:a3:d0:17 > 52:54:00:12:35:02, ethertype IPv4 (0x0800), length 100: 10.0.2.15.47587 > 172.31.1.130.53: 18166+ [1au] A? connectivity-check.ubuntu.com. (58)
14:56:14.339035 52:54:00:12:35:02 > 08:00:27:a3:d0:17, ethertype IPv4 (0x0800), length 428: 172.31.1.130.53 > 10.0.2.15.47587: 18166 9/3/7 A 185.125.190.17, A 91.189.91.49, A 35.232.111.17, A 185.125.190.18, A 91.189.91.48, A 34.122.121.32, A 185.125.190.48, A 185.125.190.49, A 35.224.170.84 (386)
14:56:14.340671 08:00:27:a3:d0:17 > 52:54:00:12:35:02, ethertype IPv4 (0x0800), length 74: 10.0.2.15.55314 > 185.125.190.17.80: Flags [S], seq 4096349232, win 64240, options [mss 1460,sackOK,TS val 3875231030 ecr 0,nop,wscale 7], length 0
14:56:14.509515 52:54:00:12:35:02 > 08:00:27:a3:d0:17, ethertype IPv4 (0x0800), length 60: 185.125.190.17.80 > 10.0.2.15.55314: Flags [S.], seq 50048001, ack 4096349233, win 65535, options [mss 1460], length 0
14:56:14.509774 08:00:27:a3:d0:17 > 52:54:00:12:35:02, ethertype IPv4 (0x0800), length 54: 10.0.2.15.55314 > 185.125.190.17.80: Flags [.], ack 1, win 64240, length 0
14:56:14.510780 08:00:27:a3:d0:17 > 52:54:00:12:35:02, ethertype IPv4 (0x0800), length 141: 10.0.2.15.55314 > 185.125.190.17.80: Flags [P.], seq 1:88, ack 1, win 64240, length 87: HTTP: GET / HTTP/1.1
14:56:14.511258 52:54:00:12:35:02 > 08:00:27:a3:d0:17, ethertype IPv4 (0x0800), length 60: 185.125.190.17.80 > 10.0.2.15.55314: Flags [.], ack 88, win 65535, length 0
14:56:14.681279 52:54:00:12:35:02 > 08:00:27:a3:d0:17, ethertype IPv4 (0x0800), length 243: 185.125.190.17.80 > 10.0.2.15.55314: Flags [P.], seq 1:190, ack 88, win 65535, length 189: HTTP: HTTP/1.1 204 No Content
